{
  "$schema": "http://json-schema.org/draft-07/schema#",
  "title": "Generated schema for Root",
  "type": "array",
  "items": {
    "type": "object",
    "properties": {
      "id": {
        "type": "string"
      },
      "firstname": {
        "type": "string"
      },
      "lastname": {
        "type": "string"
      },
      "age": {
        "type": "string"
      },
      "email": {
        "type": "string"
      }
    },
    "required": [
      "id",
      "firstname",
      "lastname",
      "age",
      "email"
    ]
  }
}